rank,uri,artist_names,track_name,source,peak_rank,previous_rank,weeks_on_chart,streams
185,"spotify:track:2GylVVMD21R4SqgAt8gGC5","Felipe Amorim, Vitão, BIN, Malibu","Eu Vou na Sua Casa","One Play",2,185,39,"1179337"
186,"spotify:track:7qjZnBKE73H4Oxkopwulqe","sombr","back to friends","Warner Records",100,173,25,"1178411"
187,"spotify:track:5FVbvttjEvQ8r2BgUcJgNg","BTS","Life Goes On","BIGHIT MUSIC",35,-1,5,"1176563"
188,"spotify:track:00j16DuIL1HPHjjLMNcYX0","BK, Luccas Carlos, Arit","Planos","Pirâmide Perdida Records",156,156,3,"1173417"
189,"spotify:track:5lKHrBigpyKZM6uMvbOGh2","Natiruts, Claudia Leitte","Sorri, Sou Rei (feat. Claudia Leitte)","Sony Music Entertainment",104,-1,10,"1165102"
190,"spotify:track:0gJ5rxjMmQ1p5cooI33JVi","Dj Guuh, Mc Rodrigo do CN","VAI NO CHÃO BANDIDA","Prodok Music Group",47,135,37,"1164898"
191,"spotify:track:7aOv4uSAmiB9XKnkibqSdo","cjnobeat, Mc Morena, Mc Gw","Até Quebrar a Cama 2.0","cjnobeat",80,179,22,"1159216"
192,"spotify:track:0lPWEt7kSY37pSUIH68ME0","O Rappa","Minha alma (A paz que eu não quero)","WM Brazil",192,-1,1,"1156454"
193,"spotify:track:76qXdJtgMsCccgwbbLsy5v","Panda, MJ Records","Nos Bares da Cidade / Sem Direção - Ao Vivo","MJ Records.",129,142,14,"1155933"
194,"spotify:track:0LDT8QEHbPA0aawzm9CWP7","Charlie Brown Jr.","Meu Novo Mundo","Som Livre",170,170,2,"1150740"
195,"spotify:track:1PW3LjmxJqVoQ9nmdbxF9f","Zezé Di Camargo & Luciano","Irmão da Lua, Amigo das Estrelas","Columbia",193,-1,2,"1145251"
196,"spotify:track:19QGIdhhRCB303eGVUQyZM","O Rappa","Auto-reverse","WM Brazil",196,-1,1,"1132902"
197,"spotify:track:4YQ37NPJlIUMFo8Kq51heS","DJ TOPO, Natiruts, Yuri Redicopa, Ryuchi","QUANDO VOCÊ SE FOI CHOREI (SORRI, SOU REI)","Sony Music Entertainment",80,180,7,"1128937"
198,"spotify:track:1ir8ABEHT52sUQ5IiRYIWZ","Marília Tavares","Quero Ser o Seu Amor","WM Brazil",198,-1,1,"1124655"
199,"spotify:track:5kuUOpHZlZjL8b7HXkxRsm","Xamã, Bagua Records, Neo Beats, Matuê","Luxúria","Baguá Records",154,154,43,"1122834"
200,"spotify:track:1CPZ5BxNNd0n0nF4Orb9JS","HUNTR/X, EJAE, AUDREY NUNA, REI AMI, KPop Demon Hunters Cast","Golden","K-Pop Demon Hunters",79,-1,29,"1117221"
